{
  "NEWSLETTER_LIVE": false,
  "PAYMENTS_LIVE": false,
  "STORE_LIVE": false,
  "completed_checkpoints": [
    {
      "at_utc": "2026-08-08T20:09:06.846063Z",
      "commands": [
        "git status --short --branch"
      ],
      "deterministic_validation": [
        "read-only repository state",
        "no holdout resolution"
      ],
      "expected_artifact": "REGIMEMOE_SCORECARD.json",
      "model_role": "deterministic_evidence",
      "model_route": {
        "model": "gpt-5.6-luna",
        "reasoning": "medium"
      },
      "source_commit_or_blocker": "## main...origin/main [ahead 2]\n M orchestrate_regimemoe.py\n M regime_moe_program/REGIMEMOE_SCORECARD.json\n M regime_moe_program/REGIMEMOE_WORK_QUEUE.json\n?? regime_moe_program/.orchestrator.lock\n?? regime_moe_program/PHASE_0_ARCHITECTURE_REVIEW.md",
      "status": "TERMINAL",
      "task_id": "phase0-repository-state-smoke",
      "validation_result": "READ_ONLY_REPOSITORY_STATE_SMOKE",
      "workstream": "DATA_AND_EVALUATION"
    },
    {
      "artifact_exists": true,
      "at_utc": "2026-08-09T15:51:25.835157Z",
      "commands": [
        "validate published development-only contracts"
      ],
      "deterministic_validation": [
        "development-only scope",
        "holdout remains unresolved",
        "no market-data path resolution",
        "deterministic artifact"
      ],
      "expected_artifact": "regime-moe-lab/artifacts/g1-data-contract-validation.json",
      "model_role": "deterministic_evidence",
      "model_route": {
        "availability": "NOT_INVOKED",
        "model": "gpt-5.6-luna",
        "reasoning": "medium"
      },
      "source_commit_or_blocker": "artifact_sha256=da1936b4dfda918fc0680309a63b60891bdb32f570266151cc314163ede46012",
      "status": "TERMINAL",
      "task_id": "g1-data-contract-validation",
      "validation_result": "G1_DATA_CONTRACT_VALIDATION_PASS",
      "workstream": "DATA_AND_EVALUATION"
    },
    {
      "artifact_exists": true,
      "at_utc": "2026-08-09T15:58:57.304890Z",
      "commands": [
        "derive an evidence-only methodology outline from the thesis charter"
      ],
      "deterministic_validation": [
        "development-only scope",
        "no performance claim",
        "no holdout, capital, or advice claim",
        "deterministic artifact"
      ],
      "expected_artifact": "regime-moe-lab/thesis/proposal/METHODOLOGY_OUTLINE.md",
      "model_role": "content_product",
      "model_route": {
        "availability": "NOT_INVOKED",
        "model": "gpt-5.6-terra",
        "reasoning": "medium"
      },
      "source_commit_or_blocker": "artifact_sha256=430bffcc572287c28641d4028855086756edc10b8c72bf860f0a832aca1082a7",
      "status": "TERMINAL",
      "task_id": "thesis-methodology-outline",
      "validation_result": "THESIS_METHODOLOGY_OUTLINE_CREATED",
      "workstream": "THESIS_AND_CAREER"
    },
    {
      "artifact_exists": true,
      "at_utc": "2026-08-09T20:02:56.998567Z",
      "commands": [
        "isolated structured audit capture"
      ],
      "deterministic_validation": [
        "parsed result validates against strict JSON schema",
        "all raw transport channels retained",
        "market_data_accessed=false and holdout counters are zero"
      ],
      "expected_artifact": "regime-moe-lab/artifacts/audit_protocol/REGIMEMOE_V5_HUMAN_REVIEW_PACKET.json",
      "model_role": "independent_auditor",
      "model_route": {
        "model": "gpt-5.6-sol",
        "reasoning": "high"
      },
      "source_commit_or_blocker": "lab_commit=6477058; REGIMEMOE_AUDIT_PROTOCOL_BLOCKED",
      "status": "TERMINAL",
      "task_id": "regimemoe-v5-manifest-audit-protocol-recovery-v1",
      "validation_result": "STRUCTURED_REVIEW_CAPTURE_COMPLETE_REVIEW_INCONCLUSIVE",
      "workstream": "DATA_AND_EVALUATION"
    },
    {
      "artifact_exists": true,
      "at_utc": "2026-08-09T20:36:06.292902Z",
      "commands": [
        "compose final V5 verdict from prior C1-C7/C9 PASS and C8-only PASS"
      ],
      "deterministic_validation": [
        "V5 manifest identity unchanged",
        "allowlist identity unchanged",
        "C1-C9 all PASS",
        "zero additional market or holdout access"
      ],
      "expected_artifact": "regime-moe-lab/artifacts/REGIMEMOE_DEVELOPMENT_MANIFEST_V5_FINAL_REVIEW.json",
      "model_role": "independent_auditor",
      "model_route": {
        "model": "gpt-5.6-sol",
        "reasoning": "high"
      },
      "source_commit_or_blocker": "REGIMEMOE_DEVELOPMENT_MANIFEST_V5_FINAL_PASS",
      "status": "TERMINAL",
      "task_id": "g1-development-manifest-v5-boundary-semantics",
      "validation_result": "MANIFEST_PASS",
      "workstream": "DATA_AND_EVALUATION"
    },
    {
      "artifact_exists": true,
      "at_utc": "2026-08-09T20:36:29.306272Z",
      "commands": [
        "inventory only an explicitly configured verified development manifest"
      ],
      "deterministic_validation": [
        "V5 immutable manifest and final review hash equality",
        "no market-data path resolution",
        "holdout remains unresolved",
        "deterministic artifact"
      ],
      "expected_artifact": "regime-moe-lab/artifacts/g1-development-manifest-inventory.json",
      "model_role": "deterministic_evidence",
      "model_route": {
        "availability": "NOT_INVOKED",
        "model": "gpt-5.6-luna",
        "reasoning": "medium"
      },
      "source_commit_or_blocker": "artifact_sha256=a3e4e0fa25431c0320ba2f265266d66b4019d904da9c0d0244b8366aade83800",
      "status": "TERMINAL",
      "task_id": "g1-development-manifest-inventory",
      "validation_result": "G1_V5_MANIFEST_CONFIGURED_WITHOUT_DATA_PATH_RESOLUTION",
      "workstream": "DATA_AND_EVALUATION"
    },
    {
      "artifact_exists": true,
      "at_utc": "2026-08-09T20:51:57.123222Z",
      "commands": [
        "development contract validation"
      ],
      "deterministic_validation": [
        "deterministic artifact",
        "zero holdout access",
        "capital remains zero"
      ],
      "expected_artifact": "regime-moe-lab/artifacts/g1-development-data-contract-validation.json",
      "model_role": "deterministic_evidence",
      "model_route": {
        "availability": "NOT_INVOKED",
        "model": "gpt-5.6-luna",
        "reasoning": "medium"
      },
      "source_commit_or_blocker": "artifact_sha256=98e85ec1db4d2ed3693120ed7ff239a02dda0ac75b9d1fdbb20fe3893ff65a4c",
      "status": "TERMINAL",
      "task_id": "g1-development-data-contract-validation",
      "validation_result": "G1_DEVELOPMENT_DATA_CONTRACT_VALIDATION_PASS",
      "workstream": "DATA_AND_EVALUATION"
    },
    {
      "artifact_exists": true,
      "at_utc": "2026-08-10T08:33:01.003691Z",
      "commands": [
        "literature matrix template"
      ],
      "deterministic_validation": [
        "deterministic artifact",
        "zero holdout access",
        "capital remains zero"
      ],
      "expected_artifact": "regime-moe-lab/artifacts/thesis-literature-matrix-template.json",
      "model_role": "content_product",
      "model_route": {
        "availability": "NOT_INVOKED",
        "model": "gpt-5.6-terra",
        "reasoning": "medium"
      },
      "source_commit_or_blocker": "artifact_sha256=b2b3a9d3a860ca75827934915c823b817755a76096dc7876aea474b3a9fcc134",
      "status": "TERMINAL",
      "task_id": "thesis-literature-matrix-template",
      "validation_result": "CODEX_ARTIFACT_EXISTS",
      "workstream": "THESIS_AND_CAREER"
    },
    {
      "artifact_exists": true,
      "at_utc": "2026-08-10T08:33:19.298505Z",
      "commands": [
        "causal coverage, cadence, availability, gap and quarantine report"
      ],
      "deterministic_validation": [
        "deterministic artifact",
        "zero holdout access",
        "capital remains zero"
      ],
      "expected_artifact": "regime-moe-lab/artifacts/g1-causal-data-quality-report.json",
      "model_role": "implementation_engineer",
      "model_route": {
        "availability": "NOT_INVOKED",
        "model": "gpt-5.6-terra",
        "reasoning": "medium"
      },
      "source_commit_or_blocker": "artifact_sha256=40f7d19b81ffea2becce6ba063bd79fea9eefdaf859f5ac9e545db7610313767",
      "status": "TERMINAL",
      "task_id": "g1-causal-data-quality-report",
      "validation_result": "G1_CAUSAL_DATA_QUALITY_REPORT_PASS",
      "workstream": "DATA_AND_EVALUATION"
    },
    {
      "artifact_exists": true,
      "at_utc": "2026-08-10T08:34:47.676594Z",
      "commands": [
        "preregister non-return-based decision interval selection criteria"
      ],
      "deterministic_validation": [
        "deterministic artifact",
        "zero holdout access",
        "capital remains zero"
      ],
      "expected_artifact": "regime-moe-lab/artifacts/g1-decision-interval-selection-protocol.json",
      "model_role": "research_director",
      "model_route": {
        "availability": "NOT_INVOKED",
        "model": "gpt-5.6-sol",
        "reasoning": "high"
      },
      "source_commit_or_blocker": "artifact_sha256=43bf2c5582890e38b3f64a1cebcd185470bc4e6aa98150fcf04037134ad8c97b",
      "status": "TERMINAL",
      "task_id": "g1-decision-interval-selection-protocol",
      "validation_result": "CODEX_ARTIFACT_EXISTS",
      "workstream": "DATA_AND_EVALUATION"
    },
    {
      "artifact_exists": true,
      "at_utc": "2026-08-10T09:19:50.898702Z",
      "commands": [
        "preregister non-return-based decision interval selection criteria"
      ],
      "deterministic_validation": [
        "deterministic artifact",
        "zero holdout access",
        "capital remains zero"
      ],
      "expected_artifact": "regime-moe-lab/artifacts/g1-decision-interval-selection-protocol.json",
      "model_role": "research_director",
      "model_route": {
        "availability": "NOT_INVOKED",
        "model": "gpt-5.6-sol",
        "reasoning": "high"
      },